data/price_cache/FLY_FULL_HISTORY.json

[{"date": "2025-08-07", "o": 70, "c": 60.35, "h": 73.8, "l": 60.03, "v": 30556621.0}, {"date": "2025-08-08", "o": 54.845, "c": 50.17, "h": 57.07, "l": 49.1101, "v": 8576232.0}, {"date": "2025-08-11", "o": 49.51, "c": 53.62, "h": 54.95, "l": 49.5, "v": 3410131.0}, {"date": "2025-08-12", "o": 53.7761, "c": 51.465, "h": 55, "l": 51.34, "v": 1821507.0}, {"date": "2025-08-13", "o": 51.12, "c": 50.75, "h": 53.5999, "l": 50.6, "v": 3419342.0}, {"date": "2025-08-14", "o": 50.21, "c": 49.33, "h": 51.25, "l": 46.3118, "v": 1878470.0}, {"date": "2025-08-15", "o": 49.28, "c": 47.34, "h": 49.28, "l": 46.39, "v": 1010560.0}, {"date": "2025-08-18", "o": 47, "c": 48.62, "h": 48.73, "l": 46.33, "v": 610240}, {"date": "2025-08-19", "o": 48.551, "c": 45.48, "h": 49.19, "l": 45.01, "v": 981713}, {"date": "2025-08-20", "o": 45.43, "c": 45.27, "h": 47, "l": 45, "v": 1433535.0}, {"date": "2025-08-21", "o": 45.37, "c": 46.27, "h": 46.6, "l": 44, "v": 727165}, {"date": "2025-08-22", "o": 46.05, "c": 46.11, "h": 46.91, "l": 45.0001, "v": 1016600.0}, {"date": "2025-08-25", "o": 46.09, "c": 44.725, "h": 46.43, "l": 44.6, "v": 485620}, {"date": "2025-08-26", "o": 44.69, "c": 45.05, "h": 45.255, "l": 44.45, "v": 294397}, {"date": "2025-08-27", "o": 46.4, "c": 47.03, "h": 47.8, "l": 46.13, "v": 652074}, {"date": "2025-08-28", "o": 47.6711, "c": 47.15, "h": 48.95, "l": 46.944, "v": 570664}, {"date": "2025-08-29", "o": 46.54, "c": 45.37, "h": 46.89, "l": 45.155, "v": 376414}, {"date": "2025-09-02", "o": 45, "c": 44.23, "h": 46.09, "l": 43.6064, "v": 508308}, {"date": "2025-09-03", "o": 44.23, "c": 44.38, "h": 45.4, "l": 42.5068, "v": 902328}, {"date": "2025-09-04", "o": 44.4, "c": 42.82, "h": 44.99, "l": 42.2745, "v": 771007}, {"date": "2025-09-05", "o": 42.96, "c": 42.63, "h": 43.2769, "l": 41.57, "v": 390439}, {"date": "2025-09-08", "o": 42.55, "c": 42.78, "h": 43.24, "l": 41.75, "v": 1035564.0}, {"date": "2025-09-09", "o": 42.7, "c": 44.54, "h": 44.75, "l": 42.26, "v": 519613}, {"date": "2025-09-10", "o": 43.98, "c": 42.77, "h": 44.241, "l": 42.53, "v": 723024}, {"date": "2025-09-11", "o": 42.61, "c": 42.97, "h": 43.33, "l": 42.12, "v": 445715}, {"date": "2025-09-12", "o": 43.01, "c": 43.75, "h": 43.76, "l": 42.35, "v": 369498}, {"date": "2025-09-15", "o": 44.26, "c": 43.86, "h": 45, "l": 43.5, "v": 328583}, {"date": "2025-09-16", "o": 44, "c": 43.85, "h": 45.45, "l": 43.58, "v": 610869}, {"date": "2025-09-17", "o": 43.73, "c": 43.36, "h": 44.59, "l": 43.16, "v": 503605}, {"date": "2025-09-18", "o": 43.93, "c": 45.22, "h": 45.6, "l": 43.8, "v": 597088}, {"date": "2025-09-19", "o": 45.64, "c": 45.2, "h": 46.21, "l": 44.5, "v": 2087520.0}, {"date": "2025-09-22", "o": 46.31, "c": 49.52, "h": 49.59, "l": 45.66, "v": 2174111.0}, {"date": "2025-09-23", "o": 43.56, "c": 41.94, "h": 44.89, "l": 41.368, "v": 3555460.0}, {"date": "2025-09-24", "o": 42.26, "c": 40.56, "h": 42.631, "l": 40.27, "v": 1541138.0}, {"date": "2025-09-25", "o": 39.9, "c": 37.66, "h": 40, "l": 36.69, "v": 2357274.0}, {"date": "2025-09-26", "o": 37.6, "c": 35.98, "h": 37.6576, "l": 35.01, "v": 1652846.0}, {"date": "2025-09-29", "o": 36, "c": 36.96, "h": 36.99, "l": 34.53, "v": 1664887.0}, {"date": "2025-09-30", "o": 31.755, "c": 29.32, "h": 32, "l": 27.55, "v": 7673008.0}, {"date": "2025-10-01", "o": 29.535, "c": 26.67, "h": 29.535, "l": 26.335, "v": 5106526.0}, {"date": "2025-10-02", "o": 26.975, "c": 26.8, "h": 28.24, "l": 26.05, "v": 3377218.0}, {"date": "2025-10-03", "o": 27.12, "c": 27.37, "h": 28, "l": 26.545, "v": 2784079.0}, {"date": "2025-10-06", "o": 30.875, "c": 29.09, "h": 30.9599, "l": 28.61, "v": 4947818.0}, {"date": "2025-10-07", "o": 29.25, "c": 28.44, "h": 29.7863, "l": 28.13, "v": 2618914.0}, {"date": "2025-10-08", "o": 28.61, "c": 31, "h": 31.68, "l": 28.3, "v": 4007763.0}, {"date": "2025-10-09", "o": 32.2, "c": 30.06, "h": 33.32, "l": 29.775, "v": 4144917.0}, {"date": "2025-10-10", "o": 30.96, "c": 28.36, "h": 31.96, "l": 28.35, "v": 2860207.0}, {"date": "2025-10-13", "o": 28.63, "c": 29.88, "h": 30.33, "l": 28.6, "v": 1529321.0}, {"date": "2025-10-14", "o": 29.27, "c": 30.09, "h": 31.215, "l": 27.81, "v": 1919645.0}, {"date": "2025-10-15", "o": 30.43, "c": 29.6, "h": 31.2, "l": 28.94, "v": 1396540.0}, {"date": "2025-10-16", "o": 29.8, "c": 28.05, "h": 29.9, "l": 27.81, "v": 1649029.0}, {"date": "2025-10-17", "o": 27.61, "c": 26.36, "h": 27.99, "l": 25.85, "v": 1883652.0}, {"date": "2025-10-20", "o": 26.38, "c": 27.12, "h": 27.46, "l": 26.21, "v": 1167392.0}, {"date": "2025-10-21", "o": 26.85, "c": 28.18, "h": 28.75, "l": 26.36, "v": 1349325.0}, {"date": "2025-10-22", "o": 27.8, "c": 26.24, "h": 28.11, "l": 25.5, "v": 1865942.0}, {"date": "2025-10-23", "o": 25.81, "c": 25.96, "h": 26.74, "l": 25.81, "v": 1026077.0}, {"date": "2025-10-24", "o": 26.48, "c": 26.92, "h": 27.6872, "l": 26.41, "v": 1342252.0}, {"date": "2025-10-27", "o": 27.2, "c": 27.49, "h": 27.72, "l": 26.745, "v": 987037}, {"date": "2025-10-28", "o": 27.44, "c": 25.77, "h": 27.59, "l": 25.72, "v": 1318112.0}, {"date": "2025-10-29", "o": 25.67, "c": 25.05, "h": 25.77, "l": 24.65, "v": 1957762.0}, {"date": "2025-10-30", "o": 24.51, "c": 24.45, "h": 25.07, "l": 24.0601, "v": 972088}, {"date": "2025-10-31", "o": 24.45, "c": 24.26, "h": 24.76, "l": 23.81, "v": 1193750.0}, {"date": "2025-11-03", "o": 24.06, "c": 23.78, "h": 24.0666, "l": 23.2007, "v": 982120}, {"date": "2025-11-04", "o": 22.66, "c": 22.85, "h": 24.3, "l": 22.48, "v": 1269680.0}, {"date": "2025-11-05", "o": 22.61, "c": 22.5, "h": 22.87, "l": 22.17, "v": 1080734.0}, {"date": "2025-11-06", "o": 22.22, "c": 19.33, "h": 22.275, "l": 19.1901, "v": 2607472.0}, {"date": "2025-11-07", "o": 19.02, "c": 19.74, "h": 20.25, "l": 18.39, "v": 2365602.0}, {"date": "2025-11-10", "o": 20, "c": 19.24, "h": 20.2892, "l": 18.82, "v": 1388291.0}, {"date": "2025-11-11", "o": 19, "c": 19.13, "h": 19.57, "l": 18.43, "v": 1216017.0}, {"date": "2025-11-12", "o": 19.26, "c": 18.31, "h": 19.48, "l": 18.2101, "v": 2410312.0}, {"date": "2025-11-13", "o": 22.67, "c": 21.42, "h": 24.22, "l": 20.41, "v": 8164845.0}, {"date": "2025-11-14", "o": 20.97, "c": 22.95, "h": 24.35, "l": 20.82, "v": 4459678.0}, {"date": "2025-11-17", "o": 22.975, "c": 19.48, "h": 22.975, "l": 19.12, "v": 3628753.0}, {"date": "2025-11-18", "o": 19, "c": 19.76, "h": 20.0895, "l": 18.85, "v": 2150422.0}, {"date": "2025-11-19", "o": 19.73, "c": 19.42, "h": 20.21, "l": 19.11, "v": 1451926.0}, {"date": "2025-11-20", "o": 19.61, "c": 16.92, "h": 20, "l": 16.9, "v": 2753802.0}, {"date": "2025-11-21", "o": 17.03, "c": 16.78, "h": 17.4, "l": 16, "v": 2111561.0}, {"date": "2025-11-24", "o": 16.75, "c": 16.86, "h": 17.05, "l": 16.3625, "v": 1569536.0}, {"date": "2025-11-25", "o": 16.97, "c": 17.34, "h": 17.84, "l": 16.82, "v": 1523333.0}, {"date": "2025-11-26", "o": 17.62, "c": 17.43, "h": 18.28, "l": 17.17, "v": 1464102.0}, {"date": "2025-11-28", "o": 17.66, "c": 17.71, "h": 18.0599, "l": 17.485, "v": 720623}, {"date": "2025-12-01", "o": 17.19, "c": 16.81, "h": 17.2662, "l": 16.55, "v": 1475853.0}, {"date": "2025-12-02", "o": 16.94, "c": 17.9, "h": 18.525, "l": 16.84, "v": 2096823.0}, {"date": "2025-12-03", "o": 17.85, "c": 18.55, "h": 18.86, "l": 17.51, "v": 1811349.0}, {"date": "2025-12-04", "o": 18.69, "c": 20.22, "h": 20.5, "l": 18.56, "v": 2279081.0}, {"date": "2025-12-05", "o": 20.38, "c": 19.81, "h": 21.015, "l": 19.665, "v": 1881834.0}, {"date": "2025-12-08", "o": 20.05, "c": 19.13, "h": 20.38, "l": 18.45, "v": 1755560.0}, {"date": "2025-12-09", "o": 19.15, "c": 19.46, "h": 19.95, "l": 18.63, "v": 1342189.0}, {"date": "2025-12-10", "o": 19.52, "c": 21.3, "h": 21.88, "l": 18.99, "v": 3501764.0}, {"date": "2025-12-11", "o": 21.85, "c": 23.51, "h": 23.83, "l": 20.56, "v": 3664750.0}, {"date": "2025-12-12", "o": 23.78, "c": 22.1, "h": 24.19, "l": 21.63, "v": 3775308.0}, {"date": "2025-12-15", "o": 22.32, "c": 20.36, "h": 23.66, "l": 20.32, "v": 3730181.0}, {"date": "2025-12-16", "o": 20, "c": 20.28, "h": 20.66, "l": 19.3601, "v": 1511897.0}, {"date": "2025-12-17", "o": 20.39, "c": 18.53, "h": 20.62, "l": 18.52, "v": 1527521.0}, {"date": "2025-12-18", "o": 19.21, "c": 20.07, "h": 20.3, "l": 18.94, "v": 1882200.0}, {"date": "2025-12-19", "o": 20.34, "c": 24.65, "h": 24.91, "l": 20.3001, "v": 8173113.0}, {"date": "2025-12-22", "o": 25.51, "c": 28.6, "h": 28.74, "l": 25.33, "v": 6374374.0}, {"date": "2025-12-23", "o": 26.28, "c": 26.46, "h": 27.48, "l": 25.91, "v": 4372345.0}, {"date": "2025-12-24", "o": 27.09, "c": 27.04, "h": 27.9, "l": 25.46, "v": 2101532.0}, {"date": "2025-12-26", "o": 27, "c": 23.34, "h": 27.1499, "l": 23.05, "v": 3822293.0}, {"date": "2025-12-29", "o": 22.92, "c": 23.6, "h": 24.85, "l": 22.78, "v": 2880035.0}, {"date": "2025-12-30", "o": 23.86, "c": 22.72, "h": 24.45, "l": 22.695, "v": 3328752.0}, {"date": "2025-12-31", "o": 22.75, "c": 22.37, "h": 23.14, "l": 21.97, "v": 3124758.0}, {"date": "2026-01-02", "o": 23.11, "c": 23.76, "h": 23.82, "l": 21.618, "v": 4133609.0}, {"date": "2026-01-05", "o": 24.62, "c": 25.77, "h": 26.07, "l": 23.75, "v": 3835857.0}, {"date": "2026-01-06", "o": 26.13, "c": 26.45, "h": 27.2199, "l": 25, "v": 4122360.0}, {"date": "2026-01-07", "o": 26.255, "c": 27.35, "h": 29.01, "l": 25.3, "v": 3681502.0}, {"date": "2026-01-08", "o": 28.1, "c": 27.99, "h": 31.25, "l": 27.47, "v": 4255342.0}, {"date": "2026-01-09", "o": 28.445, "c": 30.11, "h": 31, "l": 26.51, "v": 4235215.0}, {"date": "2026-01-12", "o": 30.38, "c": 30.44, "h": 30.64, "l": 28.33, "v": 2646403.0}, {"date": "2026-01-13", "o": 31.42, "c": 27.97, "h": 31.5, "l": 27.4557, "v": 3747093.0}, {"date": "2026-01-14", "o": 27.5, "c": 30.01, "h": 30.05, "l": 26.43, "v": 3983387.0}, {"date": "2026-01-15", "o": 29.7, "c": 29.75, "h": 30.88, "l": 28.92, "v": 2361960.0}, {"date": "2026-01-16", "o": 30.79, "c": 33.41, "h": 34.3293, "l": 30.66, "v": 5026793.0}, {"date": "2026-01-20", "o": 31.45, "c": 30.34, "h": 34.37, "l": 30.29, "v": 4034332.0}, {"date": "2026-01-21", "o": 31, "c": 28.9, "h": 31.21, "l": 27.4, "v": 4966413.0}, {"date": "2026-01-22", "o": 29.48, "c": 30.92, "h": 31.15, "l": 28.89, "v": 2527525.0}, {"date": "2026-01-23", "o": 31.5, "c": 29.13, "h": 31.99, "l": 29.08, "v": 3137621.0}, {"date": "2026-01-26", "o": 29.33, "c": 25.2, "h": 29.33, "l": 24.84, "v": 4711133.0}, {"date": "2026-01-27", "o": 25.56, "c": 29.35, "h": 29.729, "l": 25.2, "v": 3867030.0}, {"date": "2026-01-28", "o": 29.33, "c": 28.86, "h": 30.19, "l": 27.2401, "v": 3526354.0}, {"date": "2026-01-29", "o": 28.66, "c": 27.09, "h": 28.9, "l": 26.2, "v": 2811570.0}, {"date": "2026-01-30", "o": 26.5, "c": 25.2, "h": 27.765, "l": 24.41, "v": 2962657.0}, {"date": "2026-02-02", "o": 24.52, "c": 22.86, "h": 25.49, "l": 22.31, "v": 4446352.0}, {"date": "2026-02-03", "o": 23.7, "c": 25.06, "h": 25.1199, "l": 22.95, "v": 5368086.0}, {"date": "2026-02-04", "o": 25.05, "c": 24.41, "h": 25.05, "l": 23.055, "v": 5226140.0}, {"date": "2026-02-05", "o": 23.19, "c": 22.395, "h": 24.43, "l": 21.95, "v": 2341477.0}, {"date": "2026-02-06", "o": 23.39, "c": 23.88, "h": 24.44, "l": 23.1101, "v": 2619341.0}, {"date": "2026-02-09", "o": 24, "c": 24.71, "h": 25.32, "l": 23.4, "v": 2963556.0}, {"date": "2026-02-10", "o": 24.36, "c": 23, "h": 24.63, "l": 22.94, "v": 2106768.0}, {"date": "2026-02-11", "o": 23.1, "c": 20.82, "h": 23.2908, "l": 20.45, "v": 3629802.0}, {"date": "2026-02-12", "o": 20.84, "c": 19.13, "h": 20.86, "l": 18.8, "v": 3101412.0}, {"date": "2026-02-13", "o": 19.1, "c": 19.3, "h": 20.4, "l": 18.9378, "v": 2315717.0}, {"date": "2026-02-17", "o": 19, "c": 20.38, "h": 21.7, "l": 18.6177, "v": 4286049.0}, {"date": "2026-02-18", "o": 20.35, "c": 21.47, "h": 22, "l": 20.16, "v": 2743896.0}, {"date": "2026-02-19", "o": 20.75, "c": 21.53, "h": 21.9099, "l": 20.52, "v": 1612019.0}, {"date": "2026-02-20", "o": 21, "c": 19.98, "h": 21.76, "l": 19.84, "v": 2110372.0}, {"date": "2026-02-23", "o": 19.49, "c": 19.98, "h": 20.2, "l": 19.21, "v": 1370299.552469}, {"date": "2026-02-24", "o": 19.98, "c": 20.7, "h": 20.72, "l": 19.12, "v": 1643360.622741}, {"date": "2026-02-25", "o": 20.7, "c": 20.35, "h": 21.03, "l": 19.96, "v": 2261877.174555}, {"date": "2026-02-26", "o": 20.38, "c": 21.53, "h": 21.78, "l": 20.05, "v": 2951299.544895}, {"date": "2026-02-27", "o": 20.47, "c": 19.27, "h": 20.69, "l": 18.8415, "v": 3580201.555291}, {"date": "2026-03-02", "o": 18.5, "c": 20.92, "h": 21.45, "l": 18.1116, "v": 3033918.266518}, {"date": "2026-03-03", "o": 20.3, "c": 20.86, "h": 21.2499, "l": 19.56, "v": 1493458.46202}, {"date": "2026-03-04", "o": 20.84, "c": 21.4, "h": 21.93, "l": 20.71, "v": 1952460.475128}, {"date": "2026-03-05", "o": 21.105, "c": 20.38, "h": 21.61, "l": 19.45, "v": 1758299.111112}, {"date": "2026-03-06", "o": 19.98, "c": 19.73, "h": 21.16, "l": 19.535, "v": 1524159.719853}, {"date": "2026-03-09", "o": 19.53, "c": 20.75, "h": 21.035, "l": 19.22, "v": 2533779.03658}, {"date": "2026-03-10", "o": 20.16, "c": 19.39, "h": 20.16, "l": 18.81, "v": 3296609.743483}, {"date": "2026-03-11", "o": 19.18, "c": 20.6, "h": 20.615, "l": 19.15, "v": 2608764.993991}, {"date": "2026-03-12", "o": 23.7, "c": 23.23, "h": 25.17, "l": 22.9101, "v": 14211550.192742}, {"date": "2026-03-13", "o": 23.84, "c": 23.47, "h": 25.3299, "l": 23.33, "v": 5604785.347824}, {"date": "2026-03-16", "o": 23.9, "c": 23.93, "h": 25.19, "l": 22.77, "v": 3622028.792344}, {"date": "2026-03-17", "o": 23.92, "c": 24.58, "h": 25.03, "l": 23.5777, "v": 3062309.429781}, {"date": "2026-03-18", "o": 24.07, "c": 23.19, "h": 24.49, "l": 23.05, "v": 3616951.694853}, {"date": "2026-03-19", "o": 22.13, "c": 22.96, "h": 23.47, "l": 21.94, "v": 5401346.217177}, {"date": "2026-03-20", "o": 25.55, "c": 23.22, "h": 27.17, "l": 22.12, "v": 16002398.34243}, {"date": "2026-03-23", "o": 22.64, "c": 24.01, "h": 25.025, "l": 21.53, "v": 7748057.545339}, {"date": "2026-03-24", "o": 23.64, "c": 23.73, "h": 24.3, "l": 22.57, "v": 5139932.296894}, {"date": "2026-03-25", "o": 24.63, "c": 27.53, "h": 28.34, "l": 24.31, "v": 9597478.542773}, {"date": "2026-03-26", "o": 26.9, "c": 26.81, "h": 28.12, "l": 25.72, "v": 6403967.920623}, {"date": "2026-03-27", "o": 26.2, "c": 23.705, "h": 26.67, "l": 23.03, "v": 6455002.503854}, {"date": "2026-03-30", "o": 24.02, "c": 23.62, "h": 24.61, "l": 22.7817, "v": 5325213.358816}, {"date": "2026-03-31", "o": 24.675, "c": 28.47, "h": 28.71, "l": 24.525, "v": 9350645.704424}, {"date": "2026-04-01", "o": 29.12, "c": 29.76, "h": 31.37, "l": 28.84, "v": 9837527.669671}, {"date": "2026-04-02", "o": 27.56, "c": 32.93, "h": 33.08, "l": 27.42, "v": 7745301.185722}, {"date": "2026-04-06", "o": 33.87, "c": 34.85, "h": 35.8, "l": 32.562, "v": 10061549.812983}, {"date": "2026-04-07", "o": 33.67, "c": 35.57, "h": 36.1, "l": 32.16, "v": 9070245.808567}, {"date": "2026-04-08", "o": 38.1, "c": 38.12, "h": 39.86, "l": 36.03, "v": 9681612.665027}, {"date": "2026-04-09", "o": 37.985, "c": 37.57, "h": 41.51, "l": 37.275, "v": 13195734.059368}, {"date": "2026-04-10", "o": 37.425, "c": 37.54, "h": 39.75, "l": 36.15, "v": 6902083.344024}, {"date": "2026-04-13", "o": 36.71, "c": 38.8, "h": 39.63, "l": 36.7, "v": 5499507.417117}, {"date": "2026-04-14", "o": 40.405, "c": 36.61, "h": 40.99, "l": 34.08, "v": 9972824.83486}, {"date": "2026-04-15", "o": 36.56, "c": 37.62, "h": 37.69, "l": 35.06, "v": 5025196.000838}, {"date": "2026-04-16", "o": 38.04, "c": 44.17, "h": 44.3192, "l": 37.08, "v": 9149317.193838}, {"date": "2026-04-17", "o": 44.65, "c": 43.72, "h": 46.28, "l": 42.96, "v": 7762396.361595}, {"date": "2026-04-20", "o": 43.04, "c": 42.79, "h": 46.2959, "l": 42.25, "v": 4886665.668405}, {"date": "2026-04-21", "o": 43.54, "c": 42.09, "h": 44.86, "l": 41.8301, "v": 4918541.917843}, {"date": "2026-04-22", "o": 43.45, "c": 41.45, "h": 45.75, "l": 39.22, "v": 6833600.065638}, {"date": "2026-04-23", "o": 40.65, "c": 38.54, "h": 40.96, "l": 36.9001, "v": 4464078.950197}, {"date": "2026-04-24", "o": 39.18, "c": 35.13, "h": 39.31, "l": 35, "v": 4973597.886359}, {"date": "2026-04-27", "o": 35.18, "c": 34.51, "h": 36.01, "l": 33, "v": 4465734.327038}, {"date": "2026-04-28", "o": 33.56, "c": 34.215, "h": 34.845, "l": 32.79, "v": 3393982.597151}, {"date": "2026-04-29", "o": 33.7, "c": 33.49, "h": 33.7, "l": 31.2355, "v": 3609732.022892}, {"date": "2026-04-30", "o": 33.75, "c": 34.6, "h": 35.45, "l": 33.1, "v": 4144183.470664}, {"date": "2026-05-01", "o": 35.12, "c": 33.8, "h": 35.12, "l": 32.5645, "v": 3319792.13012}, {"date": "2026-05-04", "o": 33.8, "c": 33.37, "h": 34.48, "l": 32.35, "v": 4959760.237233}, {"date": "2026-05-05", "o": 38.69, "c": 31.52, "h": 39.138, "l": 31.3, "v": 8563413.953518}, {"date": "2026-05-06", "o": 32.66, "c": 34.55, "h": 35.99, "l": 32.2, "v": 7950281.745677}, {"date": "2026-05-07", "o": 34.615, "c": 32.36, "h": 35.1999, "l": 31.81, "v": 3701811.871136}, {"date": "2026-05-08", "o": 33.315, "c": 39.68, "h": 40.4, "l": 32.775, "v": 11917290.789324}, {"date": "2026-05-11", "o": 38.44, "c": 38.24, "h": 40.355, "l": 36.9, "v": 7972931.741567}, {"date": "2026-05-12", "o": 36.96, "c": 39.32, "h": 40.23, "l": 36.25, "v": 7167606.856317}, {"date": "2026-05-13", "o": 39.99, "c": 39.37, "h": 41, "l": 38.0101, "v": 6071779.874306}, {"date": "2026-05-14", "o": 39.655, "c": 42.38, "h": 43.6, "l": 38.28, "v": 8358658.510365}, {"date": "2026-05-15", "o": 40.65, "c": 40.43, "h": 42.1499, "l": 37.652, "v": 8251717.718644}, {"date": "2026-05-18", "o": 43.31, "c": 43.95, "h": 47.71, "l": 42.34, "v": 9863396.11993}, {"date": "2026-05-19", "o": 42.945, "c": 42.57, "h": 43.56, "l": 39.11, "v": 5832674.237973}, {"date": "2026-05-20", "o": 43.63, "c": 44, "h": 45.1, "l": 41.8, "v": 5779466.07455}, {"date": "2026-05-21", "o": 42.515, "c": 42.86, "h": 43.15, "l": 40.65, "v": 4349163.362039}, {"date": "2026-05-22", "o": 42.93, "c": 49.5, "h": 50.02, "l": 42.93, "v": 8821802.824884}, {"date": "2026-05-26", "o": 53.29, "c": 58.81, "h": 62.17, "l": 51.99, "v": 15777620.425535}, {"date": "2026-05-27", "o": 58.67, "c": 57.28, "h": 62.15, "l": 55.25, "v": 11663818.790876}, {"date": "2026-05-28", "o": 57, "c": 49.37, "h": 57, "l": 48.53, "v": 15318804.568054}, {"date": "2026-05-29", "o": 46.44, "c": 46.49, "h": 47.305, "l": 44, "v": 22389156.060387}, {"date": "2026-06-01", "o": 44.96, "c": 44.24, "h": 46.0174, "l": 39.75, "v": 16244813.996385}, {"date": "2026-06-02", "o": 44.03, "c": 43.37, "h": 46.44, "l": 43.0301, "v": 6220033.31503}, {"date": "2026-06-03", "o": 42.23, "c": 39.78, "h": 44.8, "l": 39.34, "v": 8024694.393742}, {"date": "2026-06-04", "o": 38.78, "c": 41.33, "h": 42.98, "l": 38.102, "v": 6284139.285504}, {"date": "2026-06-05", "o": 39.685, "c": 36.1, "h": 40.79, "l": 35.55, "v": 6683984.898762}, {"date": "2026-06-08", "o": 37.18, "c": 36.18, "h": 38.2, "l": 35.68, "v": 4218837.163135}, {"date": "2026-06-09", "o": 37.94, "c": 33.445, "h": 38, "l": 31.91, "v": 6331923.11225}, {"date": "2026-06-10", "o": 34.75, "c": 33.42, "h": 35.35, "l": 32.67, "v": 5151191.942818}, {"date": "2026-06-11", "o": 34.825, "c": 39.37, "h": 39.53, "l": 34.354, "v": 10324141.452159}, {"date": "2026-06-12", "o": 38.685, "c": 31.87, "h": 39.2499, "l": 31.4, "v": 14603922.640769}]

outputs/phase3_p6_direction_classify_v1.md

### AAOI (n_long=186  n_short=3)

**[3]** pred=`6dd0479f-6162-4234-8543-31be57862dfc` pub=2026-03-13 entry=2026-03-16 px=$100.00
- LLM: dir=short conv=3 hz=short_term qc=None hedged=0
- 1m: 100.0 raw=N/A excess=-42.55%
- 原文: `Short term, $AAOI is diluting $250m at $100 so probably won’t go too high above that number for awhile.

### AXTI (n_long=156  n_short=1)

**[1]** pred=`39e9dee8-b564-4775-8c30-5675a80e55be` pub=2026-04-06 entry=2026-04-07 px=$42.70
- LLM: dir=short conv=3 hz=event_driven qc=None hedged=0
- 1m: 42.7 raw=N/A excess=-145.50%
- 原文: `If you’re curious about $AXTI:

### CRWV (n_long=30  n_short=12)

Oracle is down 39.8% from September 11th highs and brought down the sector with it.

**[9]** pred=`8ae273f0-77fd-4bb5-8f01-efd5ebdc63e8` pub=2026-01-28 entry=2026-01-29 px=$103.86
- LLM: dir=short conv=4 hz=long_term qc=None hedged=0
- 1m: 103.86 raw=N/A excess=+24.85%
- 原文: `Thinking about buying $CRWV on the $NVDA deal?

**[11]** pred=`a95297b0-ba35-4dbd-9675-4594ec8f91a6` pub=2026-01-28 entry=2026-01-29 px=$103.86
- LLM: dir=short conv=4 hz=long_term qc=None hedged=0
- 1m: 103.86 raw=N/A excess=+24.85%
- 原文: `$CRWV is probably the only $50B+ company I can think of that is likely going to go bankrupt. At least $ORCL has a profitable core business and owns tons of assets like  15% of Tiktok.

### IREN (n_long=74  n_short=24)

**[4]** pred=`dd1f076f-4d6e-4947-8a44-1c97baf7ad02` pub=2025-11-14 entry=2025-11-17 px=$46.11
- LLM: dir=short conv=3 hz=long_term qc=None hedged=0
- 1m: 46.11 raw=N/A excess=+22.36%
- 原文: `Institutional Flow assessment for 13F Neocloud filings:

**[6]** pred=`f7ef86d9-6fec-44e9-b5c3-34656003fb1e` pub=2025-11-20 entry=2025-11-21 px=$42.86
- LLM: dir=short conv=4 hz=long_term qc=None hedged=0
- 1m: 42.86 raw=N/A excess=+2.05%
- 原文: `I'm very precise with my wording. You skipped over "expected" while reading discussions about guided contracted capacity.

**[12]** pred=`24d787dc-572c-4290-8699-d7c380a15c68` pub=2026-03-24 entry=2026-03-25 px=$42.39
- LLM: dir=short conv=2 hz=event_driven qc=None hedged=0
- 1m: 42.39 raw=N/A excess=-19.46%
- 原文: `Much better opportunities out than $IREN.

**[13]** pred=`1ce00ef5-1187-423d-b6aa-fcc0146efb05` pub=2026-03-28 entry=2026-03-30 px=$35.89
- LLM: dir=short conv=3 hz=event_driven qc=None hedged=0
- 1m: 35.89 raw=N/A excess=-19.42%
- 原文: `With $IREN, you have $6B in newly minted selling pressure. This ATM is structural overhang in any rally.

**[14]** pred=`13098143-e148-4384-8f93-b77bff66dc46` pub=2026-03-29 entry=2026-03-30 px=$35.89
- LLM: dir=short conv=4 hz=event_driven qc=None hedged=0
- 1m: 35.89 raw=N/A excess=-19.42%
- 原文: `$IREN filed to dilute $6,000,000,000 at a $11.7B MC.

**[15]** pred=`ad983690-69e9-479a-86dc-c8ea8f115f58` pub=2026-03-29 entry=2026-03-30 px=$35.89
- LLM: dir=short conv=3 hz=event_driven qc=None hedged=0
- 1m: 35.89 raw=N/A excess=-19.42%
- 原文: `Yes, basically it. I’ve been bullish on $IREN last year.

**[19]** pred=`d2043678-a1c8-4002-8f96-60562d32bc49` pub=2026-04-13 entry=2026-04-14 px=$45.24
- LLM: dir=short conv=3 hz=long_term qc=None hedged=0
- 1m: 45.245 raw=N/A excess=-21.94%
- 原文: `@mwallacegreen3 Glad to hear it… yeah it’s like a weight lifted off your shoulders that you’re not buying into a $6B ATM printed and sold into rallies with $IREN.

### JD (n_long=0  n_short=1)

**[1]** pred=`4c3c3419-0188-4d2d-ba1d-cca26e35df70` pub=2026-02-02 entry=2026-02-03 px=$28.10
- LLM: dir=short conv=3 hz=event_driven qc=None hedged=0
- 1m: 28.1 raw=N/A excess=+9.36%
- 原文: `Markets are seeing liquidation cascades.

### NVO (n_long=4  n_short=1)

**[1]** pred=`ce9f007c-206f-46d2-a830-972ba11e8b3e` pub=2026-01-18 entry=2026-01-20 px=$60.22
- LLM: dir=short conv=3 hz=event_driven qc=None hedged=0
- 1m: 60.215 raw=N/A excess=+19.54%
- 原文: `I'm a bull that's excited about Greenland trade tensions.

### ORCL (n_long=12  n_short=6)

Oracle is down 39.8% from September 11th highs and brought down the sector with it.

**[6]** pred=`c4bc984b-1c81-4fc6-91c4-3cca6551fd71` pub=2026-01-24 entry=2026-01-26 px=$179.10
- LLM: dir=short conv=3 hz=long_term qc=None hedged=0
- 1m: 179.1 raw=N/A excess=+17.43%
- 原文: `I've been saying this about $ORCL in the 300's though too when they projected $25B capex to $50B+ in just 1 year time.

### RGTI (n_long=1  n_short=9)

**[6]** pred=`eb25fdb5-adaf-49a7-8dfa-8988cabe7115` pub=2025-10-20 entry=2025-10-21 px=$42.52
- LLM: dir=short conv=3 hz=long_term qc=None hedged=0
- 1m: 42.52 raw=N/A excess=+40.12%
- 原文: `The difference is that $NBIS is doing 4-6B forward revenue in 2026 off ~70% gross margins.

### RKLB (n_long=61  n_short=2)

**[1]** pred=`98668a95-3ee8-4568-8593-00d326a3fc05` pub=2025-12-20 entry=2025-12-22 px=$72.94
- LLM: dir=short conv=3 hz=6m qc=None hedged=0
- 1m: 72.94 raw=N/A excess=-21.88%
- 原文: `So I’d say $RKLB is definitely the most overvalued right now.